"DESCRIPTION","DURATION IN MS","NAME","PARENT SUITE","START TIME","STATUS","STOP TIME","SUB SUITE","SUITE","TEST CLASS","TEST METHOD"
"","5","rejects protected endpoints without authentication","Integration | API","2026-07-07","passed","2026-07-07","","API access control","",""
"","1","runs only on manual dispatch with a dry-run default of true","Unit | Scripts | GitHub | Rollback Production Workflow","2026-07-07","passed","2026-07-07","","","",""
"","1","disables history persistence for fork pull requests","Unit | Allure History Policy","2026-07-07","passed","2026-07-07","","","",""
"","1","flags a $ref that does not resolve","Unit | Scripts | OpenAPI | Validate Spec","2026-07-07","passed","2026-07-07","","validateRefs","",""
"","1","surfaces GitHub API failures","Unit | Scripts | GitHub | Review Dependencies","2026-07-07","passed","2026-07-07","","fetchGitHubJson","",""
"","1","supports chained registration","Unit | Services | Image Describer Factory","2026-07-07","passed","2026-07-07","","","",""
"","1","uses replicate when auto is the only configured provider","Unit | Scripts | Postman | Provider Validation Scope","2026-07-07","passed","2026-07-07","","resolveProviderScope","",""
"","0","returns no GitHub Pages URL for malformed repository identifiers","Unit | Allure History Policy","2026-07-07","passed","2026-07-07","","","",""
"","1","marks image-source download failures as skippable","Unit | Services | Ollama Describer Service","2026-07-07","passed","2026-07-07","","","",""
"","3","surfaces stale-report cleanup failures that are not missing-file errors","Unit | Scripts | Postman | Newman Runner","2026-07-07","passed","2026-07-07","","","",""
"","1","supports a future unit-local Redis topology behind an explicit flag","Unit | Config | Rate Limit Store","2026-07-07","passed","2026-07-07","","","",""
"","3","parses CLI arguments","Unit | Scripts | GitHub | Resolve Pages Source Run","2026-07-07","passed","2026-07-07","","","",""
"","4","supports equals syntax and rejects malformed arguments","Unit | Scripts | GitHub | Sync Pages State Branch","2026-07-07","passed","2026-07-07","","","",""
"","0","defaults to the committed collection","Unit | Scripts | Postman | Collection Lint","2026-07-07","passed","2026-07-07","","parseArgs","",""
"","1","parses CLI arguments with defaults","Unit | Allure History Fetcher","2026-07-07","passed","2026-07-07","","","",""
"","5","fails fast when the fixture page is not valid HTML","Unit | Scripts | Postman | Provider Validation Fixture Probe","2026-07-07","passed","2026-07-07","","","",""
"","1","maps provider timeouts during page descriptions to gateway timeout responses","Unit | Controllers | Description Controller","2026-07-07","passed","2026-07-07","","DescriptionController.describePage","",""
"","1","redirects forwarded HTTP requests using the validated forwarded host","Unit | Middleware | Request Filter","2026-07-07","passed","2026-07-07","","","",""
"","2","normalizes content types without charset noise","Unit | Scripts | Postman | Provider Validation Fixture Probe","2026-07-07","passed","2026-07-07","","","",""
"","1","keeps an explicit ALLURE_RESULTS_DIR for cross-run aggregation","Unit | Scripts | Postman | Run Layout","2026-07-07","passed","2026-07-07","","","",""
"","2","calls the API with correct url, data, and headers","Unit | Services | Azure Describer Service","2026-07-07","passed","2026-07-07","","","",""
"","2","keeps the promotion workflow hardcoded checks aligned with the policy","Unit | Scripts | GitHub | Required Check Policy","2026-07-07","passed","2026-07-07","","","",""
"","1","is a no-op when production already points to the rollback SHA","Unit | Scripts | GitHub | Rollback Production","2026-07-07","passed","2026-07-07","","deriveRollbackPlan","",""
"","1","isImage(https://example.com/photo.jpg?v=123) === true","Unit | Services | Scraper Service","2026-07-07","passed","2026-07-07","","ScraperService.isImage","",""
"","705","creates and updates the state branch","Integration | Scripts | GitHub | Sync Pages State Branch","2026-07-07","passed","2026-07-07","","","",""
"","1","parses an explicit real run","Unit | Scripts | GitHub | Rollback Production","2026-07-07","passed","2026-07-07","","parseArgs","",""
"","1","flags duplicate top-level folder names","Unit | Scripts | Postman | Collection Lint","2026-07-07","passed","2026-07-07","","lintFolderNames","",""
"","3","pins the Node toolchain in .nvmrc and defaults the setup composite to it","Unit | Jest Lane Configs","2026-07-07","passed","2026-07-07","","","",""
"","1","uses an explicit Redis integration URL without requiring a host binary","Unit | Redis Test Server Helper","2026-07-07","passed","2026-07-07","","","",""
"","4","falls back to the default trust proxy setting when config omits proxy","Unit | Application Composition","2026-07-07","passed","2026-07-07","","","",""
"","1","uses postman:live-provider as the canonical npm command","Unit | Scripts | Run Postman Live","2026-07-07","passed","2026-07-07","","package and workflow wiring","",""
"","6","throws a descriptive error for an unknown model","Unit | Services | Image Describer Factory","2026-07-07","passed","2026-07-07","","","",""
"","2","deploys the production branch web service","Unit | Render Deploy Config","2026-07-07","passed","2026-07-07","","","",""
"","1","normalizes unexpected errors into a generic internal response","Unit | Middleware | Error Handler","2026-07-07","passed","2026-07-07","","","",""
"","10","throws on a missing --spec value","Unit | Scripts | OpenAPI | Freshness Check","2026-07-07","passed","2026-07-07","","parseArgs","",""
"","10","returns 503 while the instance is draining","Integration | API","2026-07-07","passed","2026-07-07","","GET /api/health","",""
"","6","rejects invalid samples","Unit | Scripts | Performance Budget","2026-07-07","passed","2026-07-07","","","",""
"","20","rejects missing required CLI arguments","Unit | Allure History Artifact Restore","2026-07-07","passed","2026-07-07","","","",""
"","2","rejects when the Newman process cannot be spawned","Unit | Scripts | Postman | Newman Runner","2026-07-07","passed","2026-07-07","","","",""
"","1","parses equals syntax and normalizes custom API base URLs","Unit | Scripts | GitHub | Dispatch Pages Publish","2026-07-07","passed","2026-07-07","","","",""
"","4","builds raw GitHub urls for the default repository and ref","Unit | Scripts | Postman | Provider Validation Public Fixtures","2026-07-07","passed","2026-07-07","","","",""
"","1","resolves per-PR history for same-repository pull requests","Unit | Allure History Policy","2026-07-07","passed","2026-07-07","","","",""
"","1","starts servers and resolves when the listen callback fires","Unit | Server | Server Functions","2026-07-07","passed","2026-07-07","","","",""
"","13","rejects unsupported workflow kinds","Unit | Allure History Policy","2026-07-07","passed","2026-07-07","","","",""
"","17","sends a chat completion request with the remote image url","Unit | Services | OpenAI Compatible Vision Describer Service","2026-07-07","passed","2026-07-07","","","",""
"","6","returns 400 when url is missing","Integration | API","2026-07-07","passed","2026-07-07","","GET /api/accessibility/descriptions","",""
"","2","parses JSON bodies when the response is JSON","Unit | Scripts | Run Postman Deploy","2026-07-07","passed","2026-07-07","","requestDeployProbe","",""
"","0","prefers RATE_LIMIT_REDIS_URL and normalizes the prefix","Unit | Config | Rate Limit Store","2026-07-07","passed","2026-07-07","","","",""
"","12","propagates non-skippable provider failures","Unit | Providers | Adapter Contract Matrix","2026-07-07","passed","2026-07-07","","replicate provider adapter contract","",""
"","2","composes every tier without JUnit or coverage in the reporting lane","Unit | Jest Lane Configs","2026-07-07","passed","2026-07-07","","","",""
"","1","builds a fallback summary when no Newman reports are present","Unit | Scripts | GitHub | Write Newman Summary","2026-07-07","passed","2026-07-07","","","",""
"","1","flags a removed path","Unit | Scripts | OpenAPI | Contract Diff","2026-07-07","passed","2026-07-07","","diffPublicContract","",""
"","29","HTTP redirects to HTTPS","alt-text-generator API Contract Harness","2026-07-07","passed","2026-07-07","","05 Routing & Redirects","",""
"","1","forwards an internal error when the scraper service fails","Unit | Controllers | Scraper Controller","2026-07-07","passed","2026-07-07","","","",""
"","0","keeps least-privilege read-only permissions and a job timeout","Unit | Scripts | GitHub | Security Audit Workflow","2026-07-07","passed","2026-07-07","","","",""
"","14","fails open when the Redis-backed limiter store errors during a request","Integration | API","2026-07-07","passed","2026-07-07","","rate limiting","",""
"","5","keeps harden-runner out of fork-facing CI jobs","Unit | Scripts | GitHub | Workflow Hardening","2026-07-07","passed","2026-07-07","","","",""
"","1","throws when the HTTP client rejects","Unit | Services | Scraper Service","2026-07-07","passed","2026-07-07","","ScraperService.getImages","",""
"","0","normalizes case and whitespace","Unit | Scripts | Postman | Provider Validation Scope","2026-07-07","passed","2026-07-07","","normalizeProviderScope","",""
"","1","returns false for undefined","Unit | URL Validator","2026-07-07","passed","2026-07-07","","","",""
"","14","throws when a configured provider is missing a runtime builder","Unit | Providers | Runtime Registry","2026-07-07","passed","2026-07-07","","","",""
"","1","returns a no-op provider for in-memory rate limiting","Unit | Infrastructure | Rate Limit Store","2026-07-07","passed","2026-07-07","","","",""
"","0","classifies isolated image-source failures as skippable","Unit | Providers | Adapter Contract Matrix","2026-07-07","passed","2026-07-07","","ollama provider adapter contract","",""
"","1","detects configuration and validates missing api keys for dependent overrides","Unit | Providers | Definitions | Build OpenAI Compatible Provider","2026-07-07","passed","2026-07-07","","","",""
"","1","fails on disallowed licenses only when the blocking flag is set","Unit | Scripts | GitHub | Review Dependencies","2026-07-07","passed","2026-07-07","","license policy","",""
"","2","returns false for provider-endpoint failures","Unit | Providers | Shared | Is Skippable Image Source Error","2026-07-07","passed","2026-07-07","","","",""
"","48","rejects Azure credentials without an endpoint","Unit | Utils | Validate Env Vars","2026-07-07","passed","2026-07-07","","","",""
"","2","is a structurally valid OpenAPI 3 document","Unit | Scripts | OpenAPI | Validate Spec","2026-07-07","passed","2026-07-07","","committed artifact","",""
"","35","generates self-signed localhost credentials outside production","Unit | Infrastructure | Load TLS Credentials","2026-07-07","passed","2026-07-07","","","",""
"","2","parses the supported base-url flag","Unit | Scripts | Run Postman Deploy","2026-07-07","passed","2026-07-07","","parseArgs","",""
"","4","recognizes localhost and RFC1918 addresses","Unit | Scripts | Run Postman Live","2026-07-07","passed","2026-07-07","","isPrivateHostname","",""
"","0","classifies isolated image-source failures as skippable","Unit | Providers | Adapter Contract Matrix","2026-07-07","passed","2026-07-07","","openrouter provider adapter contract","",""
"","1","rejects malformed forwarded host headers instead of constructing a redirect target","Unit | Middleware | Request Filter","2026-07-07","passed","2026-07-07","","","",""
"","1","skips invalid image URLs that cannot be resolved","Unit | Services | Scraper Service","2026-07-07","passed","2026-07-07","","ScraperService.extractImageSources","",""
"","15","prefers the generated OpenAPI artifact over runtime swagger-jsdoc parsing","Unit | Config | Swagger","2026-07-07","passed","2026-07-07","","generated artifact","",""
"","1","builds local provider-validation fixture URLs","Unit | Scripts | Postman | Local Provider Mocks","2026-07-07","passed","2026-07-07","","","",""
"","7","returns 400 for an unknown model","Integration | API","2026-07-07","passed","2026-07-07","","GET /api/accessibility/description","",""
"","0","serializes Java properties safely","Unit | Allure Metadata Writer","2026-07-07","passed","2026-07-07","","","",""
"","1","caps exponential restart backoff at the configured maximum","Unit | Server | Cluster Manager","2026-07-07","passed","2026-07-07","","","",""
"","2","treats 404 history files as missing instead of failing the build","Unit | Allure History Fetcher","2026-07-07","passed","2026-07-07","","","",""
"","53","sanitizes serialized errors before they reach the logger output","Unit | Infrastructure | Logger","2026-07-07","passed","2026-07-07","","","",""
"","2","flags hardcoded live hosts on every applicable check","Unit | Scripts | Postman | Collection Lint","2026-07-07","passed","2026-07-07","","lintForbiddenUrls","",""
"","1","uses postman:post-deploy as the canonical npm command","Unit | Scripts | Run Postman Deploy","2026-07-07","passed","2026-07-07","","package and workflow wiring","",""
"","0","uploads audit artifacts with bounded retention even on failure","Unit | Scripts | GitHub | Security Audit Workflow","2026-07-07","passed","2026-07-07","","","",""
"","4","invokes postman:live-provider from the live workflow","Unit | Scripts | Run Postman Live","2026-07-07","passed","2026-07-07","","package and workflow wiring","",""
"","0","propagates prompt, model, and limit configuration","Unit | Providers | Adapter Contract Matrix","2026-07-07","passed","2026-07-07","","openai provider adapter contract","",""
"","17","keeps health checks available when the default API limiter is exhausted","Integration | API","2026-07-07","passed","2026-07-07","","rate limiting","",""
"","2","reports empty files, CRLF, and merge-conflict markers","Unit | Scripts | Docs | Validate Docs","2026-07-07","passed","2026-07-07","","","",""
"","1","keeps environment-scoped validation and bounded runtimes","Unit | Scripts | GitHub | Promote To Production Workflow","2026-07-07","passed","2026-07-07","","","",""
"","1","rejects unsupported values","Unit | Scripts | Run Postman Deploy","2026-07-07","passed","2026-07-07","","normalizeBooleanFlag","",""
"","0","does not persist branch CI history on production pushes","Unit | Allure History Policy","2026-07-07","passed","2026-07-07","","","",""
"","1","flags a security requirement naming an undeclared scheme","Unit | Scripts | OpenAPI | Validate Spec","2026-07-07","passed","2026-07-07","","validateSecurity","",""
"","1","builds deploy rollout probe URLs from the production base URL","Unit | Scripts | Run Postman Deploy","2026-07-07","passed","2026-07-07","","buildDeployProbeUrls","",""
"","3","parses supported CLI arguments","Unit | Scripts | GitHub | Review Dependencies","2026-07-07","passed","2026-07-07","","parseArgs","",""
"","1","parses --json, --help, and --collection","Unit | Scripts | Postman | Collection Lint","2026-07-07","passed","2026-07-07","","parseArgs","",""
"","3","reuses persisted description jobs while building the page result","Unit | Services | Page Description Job Service","2026-07-07","passed","2026-07-07","","","",""
"","2","keeps weekly npm and github-actions update lanes","Unit | Dependabot Policy","2026-07-07","passed","2026-07-07","","","",""
"","2","a.png is a non-trivial PNG fixture","provider validation fixtures","2026-07-07","passed","2026-07-07","","","",""
"","2","treats only explicit truthy strings as enabled flags","Unit | Scripts | Postman | Port Allocator","2026-07-07","passed","2026-07-07","","","",""
"","43","accepts valid cluster lifecycle overrides","Unit | Utils | Validate Env Vars","2026-07-07","passed","2026-07-07","","","",""
"","12","stays available while the instance is draining","Integration | API","2026-07-07","passed","2026-07-07","","GET /api/ping","",""
"","3","respects an explicit manual scope override","Unit | Scripts | GitHub | Resolve Provider Validation Scope","2026-07-07","passed","2026-07-07","","resolveScopeFromEnv","",""
"","1","rejects duplicate contexts inside a policy list","Unit | Scripts | GitHub | Required Check Policy","2026-07-07","passed","2026-07-07","","","",""
"","1","recognizes protected-branch ref update rejections","Unit | Scripts | GitHub | Promote To Production","2026-07-07","passed","2026-07-07","","isProtectedBranchRefUpdateError","",""
"","5","writes and reads page metadata","Unit | Scripts | GitHub | Page Metadata","2026-07-07","passed","2026-07-07","","","",""
"","0","uses the configured scope when the manual input is auto","Unit | Scripts | Postman | Provider Validation Scope","2026-07-07","passed","2026-07-07","","resolveProviderScope","",""
"","3","returns no-op when both branches already share the same tip SHA","Unit | Scripts | GitHub | Promote To Production","2026-07-07","passed","2026-07-07","","derivePromotionPlan","",""
"","2","ignores non-directory PR entries and folders without an index","Unit | Scripts | GitHub | Compose Pages Site","2026-07-07","passed","2026-07-07","","","",""
"","2","resolves every branch-protection context from a real workflow job","Unit | Scripts | GitHub | Required Check Policy","2026-07-07","passed","2026-07-07","","","",""
"","2","returns null for unknown assets","provider validation fixtures","2026-07-07","passed","2026-07-07","","","",""
"","1","classifies isolated image-source failures as skippable","Unit | Providers | Adapter Contract Matrix","2026-07-07","passed","2026-07-07","","huggingface provider adapter contract","",""
"","17","parses numeric overrides for worker and scraper controls","Unit | Config | Index","2026-07-07","passed","2026-07-07","","","",""
"","0","respects provider overrides when a configured provider is disabled","Unit | Scripts | Postman | Provider Validation Scope","2026-07-07","passed","2026-07-07","","detectAvailableProviders","",""
"","1","passes secure requests through so endpoint validation can handle query semantics","Unit | Middleware | Request Filter","2026-07-07","passed","2026-07-07","","","",""
"","22","pins every external action to a full-length commit SHA","Unit | Scripts | GitHub | Workflow Hardening","2026-07-07","passed","2026-07-07","","","",""
"","34","creates an installation token from the configured GitHub App secret","Unit | Scripts | GitHub | Create GitHub App Installation Token","2026-07-07","passed","2026-07-07","","createGitHubAppInstallationToken","",""
"","1","rejects unsupported image content types before calling Azure","Unit | Services | Azure Describer Service","2026-07-07","passed","2026-07-07","","","",""
"","0","rejects retired check names so stale contexts cannot come back","Unit | Scripts | GitHub | Required Check Policy","2026-07-07","passed","2026-07-07","","","",""
"","2","parses write-pages-metadata CLI arguments","Unit | Scripts | GitHub | Page Metadata","2026-07-07","passed","2026-07-07","","","",""
"","3","lists the top-level folder names from a collection","Unit | Scripts | Postman | Collection Utils","2026-07-07","passed","2026-07-07","","","",""
"","1","returns ordered descriptions on success","Unit | Controllers | Description Controller","2026-07-07","passed","2026-07-07","","DescriptionController.describePage","",""
"","0","classifies isolated image-source failures as skippable","Unit | Providers | Adapter Contract Matrix","2026-07-07","passed","2026-07-07","","openai provider adapter contract","",""
"","3","flags an embedded servers block on the base artifact","Unit | Scripts | OpenAPI | Validate Spec","2026-07-07","passed","2026-07-07","","validateNoServers","",""
"","3","composes every tier and emits JUnit in the CI lane","Unit | Jest Lane Configs","2026-07-07","passed","2026-07-07","","","",""
"","2","sanitizes an explicit run id and otherwise builds a collision-resistant one","Unit | Scripts | Postman | Run Layout","2026-07-07","passed","2026-07-07","","","",""
"","2","parses the required CLI arguments","Unit | Allure History Artifact Restore","2026-07-07","passed","2026-07-07","","","",""
"","1","stores an immediately completed provider job as a completed job response","Unit | Services | Description Job Service","2026-07-07","passed","2026-07-07","","","",""
"","168","fails fixed-port mode fast with diagnostics when a port is in use","Integration | Scripts | Postman | Harness Port & Report Isolation","2026-07-07","passed","2026-07-07","","","",""
"","3","redirects direct HTTP requests to HTTPS using the validated host header","Unit | Middleware | Request Filter","2026-07-07","passed","2026-07-07","","","",""
"","2","falls back to the store get method when no claim helper exists and returns null for missing jobs","Unit | Services | Page Description Job Service","2026-07-07","passed","2026-07-07","","","",""
"","21","allows the shared REDIS_URL to back rate limiting automatically","Unit | Config | Index","2026-07-07","passed","2026-07-07","","","",""
"","1","uses UUID-style Redis key prefixes instead of wall-clock prefixes","Unit | Jest Lane Configs","2026-07-07","passed","2026-07-07","","","",""
"","2","builds prefixed Redis store namespaces per limiter scope","Unit | Infrastructure | Rate Limit Store","2026-07-07","passed","2026-07-07","","","",""
"","1","accepts unique, trimmed request names within a folder","Unit | Scripts | Postman | Collection Lint","2026-07-07","passed","2026-07-07","","lintRequestNames","",""
"","130","redirects direct HTTP traffic to HTTPS","Integration | API","2026-07-07","passed","2026-07-07","","request filter","",""
"","18","rejects unsupported and incomplete arguments","Unit | Scripts | GitHub | Create GitHub App Installation Token","2026-07-07","passed","2026-07-07","","parseArgs","",""
"","1","falls back to azure when auto is requested and both providers are configured","Unit | Scripts | GitHub | Resolve Provider Validation Scope","2026-07-07","passed","2026-07-07","","resolveScopeFromEnv","",""
"","7","keeps the root service index public without authentication","Integration | API","2026-07-07","passed","2026-07-07","","API access control","",""
"","2","paginates compare responses and decodes snapshot warnings","Unit | Scripts | GitHub | Review Dependencies","2026-07-07","passed","2026-07-07","","listDependencyChanges","",""
"","2","writes the pid file only from the primary process","Unit | Server | Runtime Bootstrap","2026-07-07","passed","2026-07-07","","","",""
"","1","resolves refs to existing components","Unit | Scripts | OpenAPI | Validate Spec","2026-07-07","passed","2026-07-07","","validateRefs","",""
"","3","forwards a validation error when url is missing","Unit | Controllers | Scraper Controller","2026-07-07","passed","2026-07-07","","","",""
"","1","prefers explicitly provided required checks","Unit | Scripts | GitHub | Promote To Production","2026-07-07","passed","2026-07-07","","resolveRequiredChecks","",""
"","2","returns a pending job response for async providers","Unit | Controllers | Description Controller","2026-07-07","passed","2026-07-07","","DescriptionController.describe","",""
"","1","normalizes successful image descriptions","Unit | Providers | Adapter Contract Matrix","2026-07-07","passed","2026-07-07","","huggingface provider adapter contract","",""
"","13","throws when auth is enabled without any configured tokens","Unit | Middleware | Access Control","2026-07-07","passed","2026-07-07","","","",""
"","5","re-evaluates module-level reads on each load via a fresh registry","Unit | Test Setup | testEnv helpers","2026-07-07","passed","2026-07-07","","loadFreshModule","",""
"","13","throws on a missing --base value","Unit | Scripts | OpenAPI | Contract Diff","2026-07-07","passed","2026-07-07","","parseArgs","",""
"","72","Bare /api redirects to /api/v1/","alt-text-generator API Contract Harness","2026-07-07","passed","2026-07-07","","05 Routing & Redirects","",""
"","2","accepts two-digit, unique, ascending folder prefixes","Unit | Scripts | Postman | Collection Lint","2026-07-07","passed","2026-07-07","","lintFolderNames","",""
"","1","keeps manual deploy verification runs ephemeral unless explicitly persisted","Unit | Allure History Policy","2026-07-07","passed","2026-07-07","","","",""
"","1","fails matrix name templates the verifier cannot resolve","Unit | Scripts | GitHub | Required Check Policy","2026-07-07","passed","2026-07-07","","","",""
"","35","builds the default services when overrides are not supplied","Unit | Application Composition","2026-07-07","passed","2026-07-07","","","",""
"","12","continues to rate limit normal API traffic","Integration | API","2026-07-07","passed","2026-07-07","","rate limiting","",""
"","2","throws when request items are missing a specific status expectation","Unit | Scripts | Postman | Collection Utils","2026-07-07","passed","2026-07-07","","","",""
"","1","parses read-pages-metadata CLI arguments","Unit | Scripts | GitHub | Page Metadata","2026-07-07","passed","2026-07-07","","","",""
"","1","detects exact status assertions in request test scripts","Unit | Scripts | Postman | Collection Utils","2026-07-07","passed","2026-07-07","","","",""
"","10","extracts absolute image src attributes","Unit | Services | Scraper Service","2026-07-07","passed","2026-07-07","","ScraperService.extractImageSources","",""
"","0","applies outbound timeout handling","Unit | Providers | Adapter Contract Matrix","2026-07-07","passed","2026-07-07","","together provider adapter contract","",""
"","1","does not mark Azure auth failures as skippable","Unit | Services | Azure Describer Service","2026-07-07","passed","2026-07-07","","","",""
"","1","maps every optional provider and timeout override into the app env","Unit | Postman Harness Reporting","2026-07-07","passed","2026-07-07","","","",""
"","3","skips Redis integration only in explicit optional local mode with actionable diagnostics","Unit | Redis Test Server Helper","2026-07-07","passed","2026-07-07","","","",""
