"DESCRIPTION","DURATION IN MS","NAME","PARENT SUITE","START TIME","STATUS","STOP TIME","SUB SUITE","SUITE","TEST CLASS","TEST METHOD"
"","24","Versioned ping alias","alt-text-generator API Contract Harness","2026-07-07","passed","2026-07-07","","07 Route Aliases","",""
"","2","writes source-run fields to GitHub outputs","Unit | Scripts | GitHub | Resolve Pages Source Run","2026-07-07","passed","2026-07-07","","","",""
"","1","publishes the supported model enum identically on the description endpoints","Unit | Config | Swagger","2026-07-07","passed","2026-07-07","","public examples","",""
"","13","serves the generated artifact with the injected runtime servers","Unit | Config | Swagger","2026-07-07","passed","2026-07-07","","server URLs","",""
"","2","aggregates non-expired artifacts by name sorted by size","Unit | Scripts | GitHub | Advisory Observability Workflows","2026-07-07","passed","2026-07-07","","report-actions-storage script","",""
"","9","deploys prepared Pages artifacts from main CI runs and supports dispatch-based PR/manual backfills","Unit | Workflows | Allure Pages Publish","2026-07-07","passed","2026-07-07","","","",""
"","1","builds the GitHub Pages report URL for public GitHub repositories","Unit | Allure History Policy","2026-07-07","passed","2026-07-07","","","",""
"","1","fetches workflow run details from the GitHub API","Unit | Scripts | GitHub | Resolve Pages Source Run","2026-07-07","passed","2026-07-07","","","",""
"","12","rejects missing required arguments","Unit | Scripts | GitHub | Sync Pages State Branch","2026-07-07","passed","2026-07-07","","","",""
"","1","requires both azure endpoint and credential","Unit | Scripts | Postman | Provider Validation Scope","2026-07-07","passed","2026-07-07","","detectAvailableProviders","",""
"","1","rejects installation lookups that return no installation id","Unit | Scripts | GitHub | Create GitHub App Installation Token","2026-07-07","passed","2026-07-07","","resolveInstallationId","",""
"","27","Unversioned single description alias","alt-text-generator API Contract Harness","2026-07-07","passed","2026-07-07","","07 Route Aliases","",""
"","1","extracts axios-style config, code, headers, and body preview","Unit | Utils | Get Upstream Error Summary","2026-07-07","passed","2026-07-07","","","",""
"","1","applies overrides for the callback then restores the prior environment","Unit | Test Setup | testEnv helpers","2026-07-07","passed","2026-07-07","","withEnv","",""
"","2","derives required checks from live branch protection when none are provided","Unit | Scripts | GitHub | Promote To Production","2026-07-07","passed","2026-07-07","","resolveRequiredChecks","",""
"","0","applies outbound timeout handling","Unit | Providers | Adapter Contract Matrix","2026-07-07","passed","2026-07-07","","openrouter provider adapter contract","",""
"","31","Root Service Index","alt-text-generator API Contract Harness","2026-07-07","passed","2026-07-07","","00 Core Smoke","",""
"","4","defaults to the committed artifact","Unit | Scripts | OpenAPI | Freshness Check","2026-07-07","passed","2026-07-07","","parseArgs","",""
"","2","allows public DNS records","Unit | Infrastructure | Outbound URL Policy","2026-07-07","passed","2026-07-07","","","",""
"","3","creates the production deployment and marks it in progress through gh","Unit | Scripts | GitHub | Promote To Production","2026-07-07","passed","2026-07-07","","deployment evidence","",""
"","1","parses the license policy arguments","Unit | Scripts | GitHub | Review Dependencies","2026-07-07","passed","2026-07-07","","license policy","",""
"","0","allows public requests through when auth is configured","Unit | Middleware | Access Control","2026-07-07","passed","2026-07-07","","","",""
"","1","treats a Replicate token as sufficient enablement for replicate","Unit | Config | Provider Catalog","2026-07-07","passed","2026-07-07","","","",""
"","1","keeps production coverage scoped away from test helpers","Unit | Jest Lane Configs","2026-07-07","passed","2026-07-07","","","",""
"","5","audits workflow definitions with advisory zizmor in the actionlint job","Unit | Scripts | GitHub | Workflow Hardening","2026-07-07","passed","2026-07-07","","","",""
"","39","Unversioned scraper alias","alt-text-generator API Contract Harness","2026-07-07","passed","2026-07-07","","07 Route Aliases","",""
"","91","rejects startup when no provider is configured","Unit | Utils | Validate Env Vars","2026-07-07","passed","2026-07-07","","","",""
"","1","extracts tokens from Bearer authorization","Unit | Middleware | Access Control","2026-07-07","passed","2026-07-07","","","",""
"","7","pins release validation workflows to Hugging Face, OpenAI, and Together","Unit | Scripts | Run Postman Deploy","2026-07-07","passed","2026-07-07","","package and workflow wiring","",""
"","6","preserves duplicate entries while reusing one prediction per unique URL","Integration | API","2026-07-07","passed","2026-07-07","","GET /api/accessibility/descriptions","",""
"","1","posts GitHub workflow dispatch requests","Unit | Scripts | GitHub | Dispatch Pages Publish","2026-07-07","passed","2026-07-07","","","",""
"","2","stores Redis jobs with ttl, deletes expired payloads, and closes open clients","Unit | Infrastructure | Description Job Store","2026-07-07","passed","2026-07-07","","","",""
"","5","returns true for a valid http URL","Unit | URL Validator","2026-07-07","passed","2026-07-07","","","",""
"","1","propagates non-skippable provider failures","Unit | Providers | Adapter Contract Matrix","2026-07-07","passed","2026-07-07","","together provider adapter contract","",""
"","8","throws a helpful error when production credentials are missing","Unit | Infrastructure | Load TLS Credentials","2026-07-07","passed","2026-07-07","","","",""
"","3","builds env schema and config defaults","Unit | Providers | Definitions | Build OpenAI Compatible Provider","2026-07-07","passed","2026-07-07","","","",""
"","1","maps all to the configured providers","Unit | Scripts | Postman | Provider Validation Scope","2026-07-07","passed","2026-07-07","","getSelectedProviders","",""
"","1","parses fallback defaults when GitHub env vars are absent","Unit | Scripts | GitHub | Dispatch Pages Publish","2026-07-07","passed","2026-07-07","","","",""
"","1","resolves the Actions run log URL only when the env is complete","Unit | Scripts | GitHub | Promote To Production","2026-07-07","passed","2026-07-07","","deployment evidence","",""
"","1","rejects hostnames that resolve to blocked addresses","Unit | Infrastructure | Outbound URL Policy","2026-07-07","passed","2026-07-07","","","",""
"","5","falls back to the default loggers and replicate client","Unit | Application Composition","2026-07-07","passed","2026-07-07","","","",""
"","13","rejects missing required CLI arguments","Unit | Scripts | GitHub | Compose Pages Site","2026-07-07","passed","2026-07-07","","","",""
"","1","propagates non-skippable provider failures","Unit | Providers | Adapter Contract Matrix","2026-07-07","passed","2026-07-07","","huggingface provider adapter contract","",""
"","2","surfaces every occupied port as a conflict in the preflight diagnosis","Unit | Scripts | Postman | Port Allocator","2026-07-07","passed","2026-07-07","","","",""
"","3","does not register replicate when the Replicate token is missing","Unit | Application Composition","2026-07-07","passed","2026-07-07","","","",""
"","23","Describe fixture image A","alt-text-generator API Contract Harness","2026-07-07","passed","2026-07-07","","20 Single Description (Azure Stub)","",""
"","0","propagates prompt, model, and limit configuration","Unit | Providers | Adapter Contract Matrix","2026-07-07","passed","2026-07-07","","openrouter provider adapter contract","",""
"","3","propagates errors from the Replicate client","Unit | Services | Replicate Describer Service","2026-07-07","passed","2026-07-07","","","",""
"","2","parses the required results directory argument","Unit | Allure Metadata Writer","2026-07-07","passed","2026-07-07","","","",""
"","2","keeps provider-validation response-time budgets configurable from the environment","Unit | Scripts | Postman | Collection Utils","2026-07-07","passed","2026-07-07","","","",""
"","1","roots the run directory at POSTMAN_REPORTS_DIR when provided","Unit | Scripts | Postman | Run Layout","2026-07-07","passed","2026-07-07","","","",""
"","5","throws a helpful error when a configured certificate path is invalid","Unit | Infrastructure | Load TLS Credentials","2026-07-07","passed","2026-07-07","","","",""
"","2","parses --json, --help, and --spec","Unit | Scripts | OpenAPI | Freshness Check","2026-07-07","passed","2026-07-07","","parseArgs","",""
"","5","rejects protected endpoints when the token is not in API_AUTH_TOKENS","Integration | API","2026-07-07","passed","2026-07-07","","API access control","",""
"","1","isImage(https://example.com/noextension) === false","Unit | Services | Scraper Service","2026-07-07","passed","2026-07-07","","ScraperService.isImage","",""
"","10","publishes a PR report without overwriting the root report","Unit | Scripts | GitHub | Compose Pages Site","2026-07-07","passed","2026-07-07","","","",""
"","7","starts both servers and registers graceful shutdown","Unit | Server | Start Application Runtime","2026-07-07","passed","2026-07-07","","","",""
"","12","copies the latest valid history artifact into the results directory","Unit | Allure History Artifact Restore","2026-07-07","passed","2026-07-07","","","",""
"","3","composes every tier and enforces the gate in the coverage lane","Unit | Jest Lane Configs","2026-07-07","passed","2026-07-07","","","",""
"","2","exposes only the production server in production","Unit | Config | Swagger","2026-07-07","passed","2026-07-07","","server URLs","",""
"","3","returns a completed result when an async provider finishes within the wait window","Unit | Services | Description Job Service","2026-07-07","passed","2026-07-07","","","",""
"","82","accepts Azure provider credentials when endpoint and subscription key are set","Unit | Utils | Validate Env Vars","2026-07-07","passed","2026-07-07","","","",""
"","2","uses a fetched data url immediately for localhost images","Unit | Services | OpenAI Compatible Vision Describer Service","2026-07-07","passed","2026-07-07","","","",""
"","12","returns description and imageUrl on success","Unit | Services | Replicate Describer Service","2026-07-07","passed","2026-07-07","","","",""
"","1","allows protected requests with a matching token","Unit | Middleware | Access Control","2026-07-07","passed","2026-07-07","","","",""
"","4","returns a pending page job when the background execution does not finish within the wait window","Unit | Services | Page Description Job Service","2026-07-07","passed","2026-07-07","","","",""
"","40","rejects API auth tokens when the configured list is empty after trimming","Unit | Utils | Validate Env Vars","2026-07-07","passed","2026-07-07","","","",""
"","3","lists Markdown files while ignoring generated dependency/report directories","Unit | Scripts | Docs | Validate Docs","2026-07-07","passed","2026-07-07","","","",""
"","19","resolves the documented cluster policy defaults","Unit | Server | Cluster Manager","2026-07-07","passed","2026-07-07","","","",""
"","1","fails and blocks when an accepted budget is exceeded","Unit | Scripts | Performance Budget","2026-07-07","passed","2026-07-07","","","",""
"","233","exposes git helpers for failure-tolerant checks","Integration | Scripts | GitHub | Sync Pages State Branch","2026-07-07","passed","2026-07-07","","","",""
"","1","blocks private or special-use address fc00::1","Unit | Infrastructure | Outbound URL Policy","2026-07-07","passed","2026-07-07","","","",""
"","2","configures created HTTP servers with conservative timeout defaults","Unit | Server | Server Functions","2026-07-07","passed","2026-07-07","","","",""
"","1","returns null for unknown job ids and skips provider refresh for failed jobs","Unit | Services | Description Job Service","2026-07-07","passed","2026-07-07","","","",""
"","2","preserves array order and canonicalizes objects nested in arrays","Unit | Scripts | OpenAPI | Freshness Check","2026-07-07","passed","2026-07-07","","canonicalizeSpec","",""
"","2","rejects all scope when no provider is configured","Unit | Scripts | Postman | Provider Validation Scope","2026-07-07","passed","2026-07-07","","resolveProviderScope","",""
"","1","defaults to no explicit base and the committed artifact","Unit | Scripts | OpenAPI | Contract Diff","2026-07-07","passed","2026-07-07","","parseArgs","",""
"","1","disables history for custom deploy verification URLs","Unit | Allure History Policy","2026-07-07","passed","2026-07-07","","","",""
"","0","sets up Node with the pinned actions","Unit | Scripts | GitHub | Dependency Review Workflow","2026-07-07","passed","2026-07-07","","","",""
"","1","persists deploy-production history on production pushes","Unit | Allure History Policy","2026-07-07","passed","2026-07-07","","","",""
"","2","publishes reusable bearer and API-key security schemes","Unit | Config | Swagger","2026-07-07","passed","2026-07-07","","security and public endpoints","",""
"","24","Swagger UI","alt-text-generator API Contract Harness","2026-07-07","passed","2026-07-07","","00 Core Smoke","",""
"","1","emits grouped diagnostic lines for GitHub Actions logs","Unit | Scripts | Postman | Newman Runner","2026-07-07","passed","2026-07-07","","","",""
"","2","parses supported CLI arguments","Unit | Scripts | GitHub | Create GitHub App Installation Token","2026-07-07","passed","2026-07-07","","parseArgs","",""
"","3","discovers reports nested in a per-run directory while skipping metadata folders","Unit | Scripts | Postman | Newman Summary Discovery","2026-07-07","passed","2026-07-07","","","",""
"","1","rejects a payload that exceeds the size limit","Unit | Allure History Artifact Restore","2026-07-07","passed","2026-07-07","","assertArchivePayload","",""
"","16","responds with health info","Integration | API","2026-07-07","passed","2026-07-07","","GET /api/health","",""
"","1","flags folder names without a two-digit order prefix","Unit | Scripts | Postman | Collection Lint","2026-07-07","passed","2026-07-07","","lintFolderNames","",""
"","67","accepts TLS_* credentials in production","Unit | Utils | Validate Env Vars","2026-07-07","passed","2026-07-07","","","",""
"","0","keeps the production ruleset policy within the main branch policy","Unit | Scripts | GitHub | Required Check Policy","2026-07-07","passed","2026-07-07","","","",""
"","7","supports canceling replicate predictions","Unit | Scripts | Postman Fixture Server","2026-07-07","passed","2026-07-07","","","",""
"","26","Swagger Spec","alt-text-generator API Contract Harness","2026-07-07","passed","2026-07-07","","00 Core Smoke","",""
"","5","reuses a single in-flight job and runs the page work once for duplicate submissions","Unit | Services | Page Description Job Concurrency","2026-07-07","passed","2026-07-07","","","",""
"","1","rejects azure scope without azure credentials","Unit | Scripts | Postman | Provider Validation Scope","2026-07-07","passed","2026-07-07","","resolveProviderScope","",""
"","1","propagates non-skippable provider failures","Unit | Providers | Adapter Contract Matrix","2026-07-07","passed","2026-07-07","","openai provider adapter contract","",""
"","1","builds lockfile-exact so production installs are reproducible","Unit | Render Deploy Config","2026-07-07","passed","2026-07-07","","","",""
"","62","creates a signed JWT with the expected issuer and validity window","Unit | Scripts | GitHub | Create GitHub App Installation Token","2026-07-07","passed","2026-07-07","","buildAppJwt","",""
"","2","uses the default provider override file path when no env override is set","Unit | Config | Provider Overrides","2026-07-07","passed","2026-07-07","","","",""
"","1","blocks private or special-use address ::1","Unit | Infrastructure | Outbound URL Policy","2026-07-07","passed","2026-07-07","","","",""
"","2","uses a fast-forward update when target has no unique commits","Unit | Scripts | GitHub | Promote To Production","2026-07-07","passed","2026-07-07","","derivePromotionPlan","",""
"","2","runs monthly or manually, read-only, warning-only","Unit | Scripts | GitHub | Advisory Observability Workflows","2026-07-07","passed","2026-07-07","","perf-smoke workflow","",""
"","1","escalates shutdown failures to exit code 1","Unit | Server | Server Functions","2026-07-07","passed","2026-07-07","","","",""
"","11","isImage(https://example.com/photo.jpg) === true","Unit | Services | Scraper Service","2026-07-07","passed","2026-07-07","","ScraperService.isImage","",""
"","5","returns cached completed page jobs without launching new work","Unit | Services | Page Description Job Service","2026-07-07","passed","2026-07-07","","","",""
"","2","derives worker count and cluster mode from config","Unit | Server | Runtime Bootstrap","2026-07-07","passed","2026-07-07","","","",""
"","1","never suppresses minor or patch updates for the pinned packages","Unit | Dependabot Policy","2026-07-07","passed","2026-07-07","","","",""
"","1","falls back to the workflow event name when the source workflow event is absent","Unit | Scripts | GitHub | Resolve Pages Source Run","2026-07-07","passed","2026-07-07","","","",""
"","2","collects paginated artifact results from the GitHub API","Unit | Allure History Artifact Restore","2026-07-07","passed","2026-07-07","","","",""
"","2","reports missing failures and collection-summary issues when the JSON report is still parseable","Unit | Scripts | Postman | Newman Runner","2026-07-07","passed","2026-07-07","","","",""
"","1","requires the GitHub token","Unit | Scripts | GitHub | Review Dependencies","2026-07-07","passed","2026-07-07","","reviewDependencies","",""
"","6","returns a completed page result when the async page job finishes within the wait window","Unit | Services | Page Description Job Service","2026-07-07","passed","2026-07-07","","","",""
"","23","keeps CI topology split into fast unit matrix and canonical full gates","Unit | Jest Lane Configs","2026-07-07","passed","2026-07-07","","","",""
"","3","returns no breaking changes for an identical contract","Unit | Scripts | OpenAPI | Contract Diff","2026-07-07","passed","2026-07-07","","diffPublicContract","",""
"","15","throws on unknown arguments and a missing --spec value","Unit | Scripts | OpenAPI | Validate Spec","2026-07-07","passed","2026-07-07","","parseArgs","",""
"","1","maps each role to a distinct free port","Unit | Scripts | Postman | Port Allocator","2026-07-07","passed","2026-07-07","","","",""
"","1","recognizes same-repository pull requests","Unit | Allure History Policy","2026-07-07","passed","2026-07-07","","","",""
"","1","returns true for isolated image download failures","Unit | Providers | Shared | Is Skippable Image Source Error","2026-07-07","passed","2026-07-07","","","",""
"","11","returns 400 when image_source is missing","Integration | API","2026-07-07","passed","2026-07-07","","GET /api/accessibility/description","",""
"","2","parses the required arguments","Unit | Scripts | GitHub | Parse Security Audit Report","2026-07-07","passed","2026-07-07","","parseArgs","",""
"","2","exits the primary when the crash budget is exhausted","Unit | Server | Cluster Manager","2026-07-07","passed","2026-07-07","","","",""
"","7","parses CLI arguments","Unit | Scripts | Docs | Validate Docs","2026-07-07","passed","2026-07-07","","","",""
"","2","fails (exit 1) when the working tree drops a path from the baseline","Unit | Scripts | OpenAPI | Contract Diff","2026-07-07","passed","2026-07-07","","main","",""
"","1","rejects token responses that omit the token value","Unit | Scripts | GitHub | Create GitHub App Installation Token","2026-07-07","passed","2026-07-07","","createInstallationAccessToken","",""
"","0","returns false for unrelated failures","Unit | Providers | Shared | Is Skippable Image Source Error","2026-07-07","passed","2026-07-07","","","",""
"","1","fails when an image fixture returns the wrong content type","Unit | Scripts | Postman | Provider Validation Fixture Probe","2026-07-07","passed","2026-07-07","","","",""
"","10","uses the production base URL by default","Unit | Scripts | Run Postman Deploy","2026-07-07","passed","2026-07-07","","parseArgs","",""
"","1","returns no GitHub Pages URL for non-public GitHub hosts","Unit | Allure History Policy","2026-07-07","passed","2026-07-07","","","",""
"","1","strips trailing slashes from the base URL","Unit | Scripts | Run Postman Deploy","2026-07-07","passed","2026-07-07","","normalizeBaseUrl","",""
"","7","throws a descriptive error when Azure returns no captions","Unit | Services | Azure Describer Service","2026-07-07","passed","2026-07-07","","","",""
"","2","forwards a validation error for an invalid image_source URL","Unit | Controllers | Description Controller","2026-07-07","passed","2026-07-07","","DescriptionController.describe","",""
"","11","rejects invalid Redis integration mode and URL values","Unit | Redis Test Server Helper","2026-07-07","passed","2026-07-07","","","",""
"","16","defaults unit-local Redis to localhost when the topology flag is enabled","Unit | Config | Index","2026-07-07","passed","2026-07-07","","","",""
"","1","skips (exit 0) when no baseline resolves and --strict is absent","Unit | Scripts | OpenAPI | Contract Diff","2026-07-07","passed","2026-07-07","","main","",""
"","4","extracts request and response details from fetch-style errors","Unit | Utils | Get Upstream Error Summary","2026-07-07","passed","2026-07-07","","","",""
"","1","extracts the first caption from array payloads","Unit | Providers | Shared | Extract Caption Text","2026-07-07","passed","2026-07-07","","","",""
"","331","accepts a Replicate-only provider configuration","Unit | Utils | Validate Env Vars","2026-07-07","passed","2026-07-07","","","",""
"","9","throws a helpful error when requested folders are missing","Unit | Scripts | Postman | Collection Utils","2026-07-07","passed","2026-07-07","","","",""
"","1","exits immediately when no shutdown handler is available","Unit | Server | Register Fatal Handlers","2026-07-07","passed","2026-07-07","","","",""
"","1","isImage(https://example.com/photo.png) === true","Unit | Services | Scraper Service","2026-07-07","passed","2026-07-07","","ScraperService.isImage","",""
"","9","rejects invalid write-pages-metadata CLI arguments","Unit | Scripts | GitHub | Page Metadata","2026-07-07","passed","2026-07-07","","","",""
"","3","builds provider config sections with documented defaults and explicit overrides","Unit | Config | Provider Catalog","2026-07-07","passed","2026-07-07","","","",""
"","1","surfaces GitHub API dispatch failures","Unit | Scripts | GitHub | Dispatch Pages Publish","2026-07-07","passed","2026-07-07","","","",""
"","1","writes key-value outputs when a file is provided","Unit | Scripts | GitHub | Create GitHub App Installation Token","2026-07-07","passed","2026-07-07","","appendOutput","",""
"","1","blocks private or special-use address 10.0.0.5","Unit | Infrastructure | Outbound URL Policy","2026-07-07","passed","2026-07-07","","","",""
"","2","reports stale with structural drift when they differ","Unit | Scripts | OpenAPI | Freshness Check","2026-07-07","passed","2026-07-07","","checkFreshness","",""
"","4","restores the published history files into the results directory","Unit | Allure History Fetcher","2026-07-07","passed","2026-07-07","","","",""
"","2","declares the required fields of the public error contract","Unit | Config | Swagger","2026-07-07","passed","2026-07-07","","required schemas","",""
"","2","wraps async handlers and forwards rejected promises","Unit | Middleware | Error Handler","2026-07-07","passed","2026-07-07","","","",""
"","6","returns 202 with job metadata for pending async replicate descriptions","Integration | API","2026-07-07","passed","2026-07-07","","GET /api/accessibility/description","",""
"","6","returns description array on success","Integration | API","2026-07-07","passed","2026-07-07","","GET /api/accessibility/description","",""
"","8","flags an operation with no responses","Unit | Scripts | OpenAPI | Validate Spec","2026-07-07","passed","2026-07-07","","validateOperationResponses","",""
"","10","normalizes content types and preserves existing buffers","Unit | Providers | Shared | Fetch Image Asset","2026-07-07","passed","2026-07-07","","","",""
"","2","can restrict detection to an allowed provider subset","Unit | Scripts | Postman | Provider Validation Scope","2026-07-07","passed","2026-07-07","","detectAvailableProviders","",""
"","1","filters unsupported svg image sources for page descriptions","Unit | Services | OpenAI Compatible Vision Describer Service","2026-07-07","passed","2026-07-07","","","",""
"","2","builds environment properties from the current runtime and CI env","Unit | Allure Metadata Writer","2026-07-07","passed","2026-07-07","","","",""
"","1","gates pushes and pull requests on main and production plus manual replays","Unit | Scripts | GitHub | Dependency Review Workflow","2026-07-07","passed","2026-07-07","","","",""
"","1","isImage(https://example.com/photo.webp) === true","Unit | Services | Scraper Service","2026-07-07","passed","2026-07-07","","ScraperService.isImage","",""
"","1","flags a removed required response property on a kept schema","Unit | Scripts | OpenAPI | Contract Diff","2026-07-07","passed","2026-07-07","","diffPublicContract","",""
"","1","surfaces non-fatal startup warnings for partial azure configuration","Unit | Config | Provider Catalog","2026-07-07","passed","2026-07-07","","","",""
"","6","returns a pending async job response","Integration | API","2026-07-07","passed","2026-07-07","","GET /api/accessibility/description-jobs/:jobId","",""
