"DESCRIPTION","DURATION IN MS","NAME","PARENT SUITE","START TIME","STATUS","STOP TIME","SUB SUITE","SUITE","TEST CLASS","TEST METHOD"
"","4","formats actionable diagnostics from a Newman JSON report","Unit | Scripts | Postman | Newman Runner","2026-07-07","passed","2026-07-07","","","",""
"","2","sets an explicit outbound URL allowlist when provided","Unit | Scripts | Postman | App Server Env","2026-07-07","passed","2026-07-07","","","",""
"","1","expands all using only configured provider plans","Unit | Scripts | Postman | Provider Validation Scope","2026-07-07","passed","2026-07-07","","getSelectedProviderPlans","",""
"","2","surfaces GitHub workflow lookup failures","Unit | Scripts | GitHub | Resolve Pages Source Run","2026-07-07","passed","2026-07-07","","","",""
"","2","filters model-incompatible image sources before describing a page","Unit | Services | Page Description Service","2026-07-07","passed","2026-07-07","","","",""
"","1","classifies isolated image-source failures as skippable","Unit | Providers | Adapter Contract Matrix","2026-07-07","passed","2026-07-07","","azure provider adapter contract","",""
"","1","accepts HTML fixture pages served as text/plain when the body is valid HTML","Unit | Scripts | Postman | Provider Validation Fixture Probe","2026-07-07","passed","2026-07-07","","","",""
"","1","detects exact status-code headers on request items","Unit | Scripts | Postman | Collection Utils","2026-07-07","passed","2026-07-07","","","",""
"","11","redirects proxy-forwarded HTTP traffic to HTTPS","Integration | API","2026-07-07","passed","2026-07-07","","request filter","",""
"","10","fails fast when Redis mode is selected without a Redis URL","Unit | Infrastructure | Description Job Store","2026-07-07","passed","2026-07-07","","","",""
"","1","audits production dependencies through the repository script","Unit | Scripts | GitHub | Security Audit Workflow","2026-07-07","passed","2026-07-07","","","",""
"","2","keeps summarizing valid reports when one report is malformed","Unit | Scripts | GitHub | Write Newman Summary","2026-07-07","passed","2026-07-07","","","",""
"","1","isImage() === false","Unit | Services | Scraper Service","2026-07-07","passed","2026-07-07","","ScraperService.isImage","",""
"","1","builds local mock provider configuration URLs","Unit | Scripts | Postman | Local Provider Mocks","2026-07-07","passed","2026-07-07","","","",""
"","3","never pipes a network download straight into a shell","Unit | Supply-chain pinning posture","2026-07-07","passed","2026-07-07","","","",""
"","23","uses the documented defaults when optional env vars are unset","Unit | Config | Index","2026-07-07","passed","2026-07-07","","","",""
"","5","flags empty title and version independently","Unit | Scripts | OpenAPI | Validate Spec","2026-07-07","passed","2026-07-07","","validateInfo","",""
"","1","normalizes successful image descriptions","Unit | Providers | Adapter Contract Matrix","2026-07-07","passed","2026-07-07","","ollama provider adapter contract","",""
"","19","keeps the unit lane fast and coverage-free","Unit | Jest Lane Configs","2026-07-07","passed","2026-07-07","","","",""
"","1","uses inline PEM values when they are provided","Unit | Infrastructure | Load TLS Credentials","2026-07-07","passed","2026-07-07","","","",""
"","1","resolves workflow_run source context","Unit | Scripts | GitHub | Resolve Pages Source Run","2026-07-07","passed","2026-07-07","","","",""
"","1","applies outbound timeout handling","Unit | Providers | Adapter Contract Matrix","2026-07-07","passed","2026-07-07","","azure provider adapter contract","",""
"","10","invokes postman:post-deploy from the post-deploy workflow","Unit | Scripts | Run Postman Deploy","2026-07-07","passed","2026-07-07","","package and workflow wiring","",""
"","0","normalizes the bare /api/ route with a relative redirect","Unit | Middleware | Request Filter","2026-07-07","passed","2026-07-07","","","",""
"","1","treats the budget boundary as within budget","Unit | Scripts | Performance Budget","2026-07-07","passed","2026-07-07","","","",""
"","1","skips protected deploy verification when auth is enabled without a token","Unit | Scripts | Run Postman Deploy","2026-07-07","passed","2026-07-07","","resolveProductionDeployAuthConfig","",""
"","18","rejects invalid timeout values","Unit | Allure History Fetcher","2026-07-07","passed","2026-07-07","","","",""
"","15","redirects /api/ to the versioned route for secure requests","Integration | API","2026-07-07","passed","2026-07-07","","request filter","",""
"","3","normalizes non-error unhandled rejections into structured fatal logs","Unit | Server | Register Fatal Handlers","2026-07-07","passed","2026-07-07","","","",""
"","11","rejects invalid CLI arguments","Unit | Scripts | GitHub | Dispatch Pages Publish","2026-07-07","passed","2026-07-07","","","",""
"","1","returns undefined when no upstream details are available","Unit | Utils | Get Upstream Error Summary","2026-07-07","passed","2026-07-07","","","",""
"","2","ignores additive changes (new paths, operations, responses, optional fields)","Unit | Scripts | OpenAPI | Contract Diff","2026-07-07","passed","2026-07-07","","diffPublicContract","",""
"","1","flags a private-network host token","Unit | Scripts | Postman | Collection Lint","2026-07-07","passed","2026-07-07","","lintForbiddenUrls","",""
"","1","protects non-health endpoints with both schemes","Unit | Config | Swagger","2026-07-07","passed","2026-07-07","","security and public endpoints","",""
"","2","keeps response-time assertions categorized separately from contract checks","Unit | Postman Harness Reporting","2026-07-07","passed","2026-07-07","","","",""
"","2","refuses to write a non-ZIP payload","Unit | Allure History Artifact Restore","2026-07-07","passed","2026-07-07","","downloadArtifactArchive","",""
"","2","starts single-process runtime when worker count is one","Unit | Server | Runtime Bootstrap","2026-07-07","passed","2026-07-07","","","",""
"","3","parses supported CLI arguments","Unit | Scripts | GitHub | Write Newman Summary","2026-07-07","passed","2026-07-07","","","",""
"","4348","boots two workers on shared Redis, shares the rate-limit budget, and shuts down cleanly","Integration | Cluster Smoke (WORKER_COUNT=2)","2026-07-07","passed","2026-07-07","","","",""
"","1","warns without blocking when a provisional budget is exceeded","Unit | Scripts | Performance Budget","2026-07-07","passed","2026-07-07","","","",""
"","8","serves public provider-validation fixtures before the API router","Unit | Utils | Create Router","2026-07-07","passed","2026-07-07","","","",""
"","13","uses the explicit TLS_* settings for HTTPS config","Unit | Config | Index","2026-07-07","passed","2026-07-07","","","",""
"","3","loads configured certificate files when paths are provided","Unit | Infrastructure | Load TLS Credentials","2026-07-07","passed","2026-07-07","","","",""
"","1","applies outbound timeout handling","Unit | Providers | Adapter Contract Matrix","2026-07-07","passed","2026-07-07","","ollama provider adapter contract","",""
"","5","returns partial page descriptions when image-specific Azure failures are skippable","Integration | API","2026-07-07","passed","2026-07-07","","GET /api/accessibility/descriptions","",""
"","3","retries retryable upstream errors before succeeding","Unit | Services | OpenAI Compatible Vision Describer Service","2026-07-07","passed","2026-07-07","","","",""
"","1","maps provider timeouts to gateway timeout responses","Unit | Controllers | Description Controller","2026-07-07","passed","2026-07-07","","DescriptionController.describe","",""
"","3","parses --json, --help, and --spec","Unit | Scripts | OpenAPI | Validate Spec","2026-07-07","passed","2026-07-07","","parseArgs","",""
"","1","routes fatal exceptions through the active shutdown handler","Unit | Server | Register Fatal Handlers","2026-07-07","passed","2026-07-07","","","",""
"","4","returns a cached completed result without creating a new provider job","Unit | Services | Description Job Service","2026-07-07","passed","2026-07-07","","","",""
"","1","forwards a validation error for an invalid URL","Unit | Controllers | Scraper Controller","2026-07-07","passed","2026-07-07","","","",""
"","5","rejects artifacts with mismatched manifests without failing the build","Unit | Allure History Artifact Restore","2026-07-07","passed","2026-07-07","","","",""
"","1","rejects workflow_dispatch runs without a resolvable source workflow run ID","Unit | Scripts | GitHub | Resolve Pages Source Run","2026-07-07","passed","2026-07-07","","","",""
"","19","advances replicate predictions through processing to failure","Unit | Scripts | Postman Fixture Server","2026-07-07","passed","2026-07-07","","","",""
"","1","returns null when no candidate ref resolves","Unit | Scripts | OpenAPI | Contract Diff","2026-07-07","passed","2026-07-07","","resolveBaseline","",""
"","1","logs and exits when runtime bootstrap fails","Unit | Server | Runtime Bootstrap","2026-07-07","passed","2026-07-07","","","",""
"","1","blocks private or special-use address 192.168.1.20","Unit | Infrastructure | Outbound URL Policy","2026-07-07","passed","2026-07-07","","","",""
"","87","shares API rate-limit counters across distinct app instances","Integration | Redis Rate Limiting","2026-07-07","passed","2026-07-07","","","",""
"","1","formats byte sizes for humans","Unit | Scripts | GitHub | Advisory Observability Workflows","2026-07-07","passed","2026-07-07","","report-actions-storage script","",""
"","1","flags requests with no exact status expectation","Unit | Scripts | Postman | Collection Lint","2026-07-07","passed","2026-07-07","","lintStatusExpectations","",""
"","94","uses process-stream logging in production without touching the filesystem","Unit | Infrastructure | Logger","2026-07-07","passed","2026-07-07","","","",""
"","0","extracts tokens from X-API-Key first","Unit | Middleware | Access Control","2026-07-07","passed","2026-07-07","","","",""
"","1","renders a markdown report with cache and artifact tables","Unit | Scripts | GitHub | Advisory Observability Workflows","2026-07-07","passed","2026-07-07","","report-actions-storage script","",""
"","1","detects api-key-backed multimodal providers","Unit | Scripts | Postman | Provider Validation Scope","2026-07-07","passed","2026-07-07","","detectAvailableProviders","",""
"","2","accepts reachable image and page fixtures","Unit | Scripts | Postman | Provider Validation Fixture Probe","2026-07-07","passed","2026-07-07","","","",""
"","1","writes a clean summary when no matching vulnerabilities are added","Unit | Scripts | GitHub | Review Dependencies","2026-07-07","passed","2026-07-07","","reviewDependencies","",""
"","2","keeps least-privilege permissions with security-events write only","Unit | Scripts | GitHub | CodeQL Workflow","2026-07-07","passed","2026-07-07","","","",""
"","1","appends key-value outputs to the configured file","Unit | Scripts | GitHub | Parse Security Audit Report","2026-07-07","passed","2026-07-07","","appendOutput","",""
"","112","admits exactly the rate-limit budget under a concurrent Promise.all burst across instances","Integration | Shared Redis Concurrency","2026-07-07","passed","2026-07-07","","","",""
"","3","does not register replicate when Replicate is explicitly disabled","Unit | Application Composition","2026-07-07","passed","2026-07-07","","","",""
"","60","accepts multi-worker startup when Redis-backed rate limiting is configured","Unit | Utils | Validate Env Vars","2026-07-07","passed","2026-07-07","","","",""
"","2","defaults empty values to false","Unit | Scripts | Run Postman Deploy","2026-07-07","passed","2026-07-07","","normalizeBooleanFlag","",""
"","1","returns an empty provider map when the override file is missing","Unit | Config | Provider Overrides","2026-07-07","passed","2026-07-07","","","",""
"","52","logs a warning and ignores Azure when its config is partial","Unit | Utils | Validate Env Vars","2026-07-07","passed","2026-07-07","","","",""
"","1283","fails a critical-file coverage drop even when global coverage passes","Unit | Jest Lane Configs","2026-07-07","passed","2026-07-07","","","",""
"","1","isImage(https://example.com/photo.bmp) === true","Unit | Services | Scraper Service","2026-07-07","passed","2026-07-07","","ScraperService.isImage","",""
"","2","publishes runnable URL-encoded request examples","Unit | Config | Swagger","2026-07-07","passed","2026-07-07","","public examples","",""
"","1","returns 404 when the page-description job does not exist","Unit | Controllers | Description Controller","2026-07-07","passed","2026-07-07","","DescriptionController.getPageDescriptionJob","",""
"","3","writes a validated ZIP archive to the destination path","Unit | Allure History Artifact Restore","2026-07-07","passed","2026-07-07","","downloadArtifactArchive","",""
"","0","runs the custom reviewer through env indirection with the workflow token only","Unit | Scripts | GitHub | Dependency Review Workflow","2026-07-07","passed","2026-07-07","","","",""
"","2","accepts bare allowed ids and OR expressions, requires every AND part","Unit | Scripts | GitHub | Review Dependencies","2026-07-07","passed","2026-07-07","","license policy","",""
"","19","returns joined captions as description","Unit | Services | Azure Describer Service","2026-07-07","passed","2026-07-07","","","",""
"","1","rejects repositories that do not include an owner and repo name","Unit | Scripts | GitHub | Review Dependencies","2026-07-07","passed","2026-07-07","","buildApiUrl","",""
"","2","skips image-specific provider failures during page descriptions","Unit | Services | Page Description Service","2026-07-07","passed","2026-07-07","","","",""
"","1","returns 202 while a job is still pending","Unit | Controllers | Description Controller","2026-07-07","passed","2026-07-07","","DescriptionController.getDescriptionJob","",""
"","1","returns scraped images on success","Unit | Controllers | Scraper Controller","2026-07-07","passed","2026-07-07","","","",""
"","1","propagates non-skippable provider failures","Unit | Providers | Adapter Contract Matrix","2026-07-07","passed","2026-07-07","","ollama provider adapter contract","",""
"","1","returns null for empty listings","Unit | Scripts | GitHub | Update Deployment Status","2026-07-07","passed","2026-07-07","","pickLatestDeployment","",""
"","2","uses the canonical production base URL by default","Unit | Scripts | Run Postman Live","2026-07-07","passed","2026-07-07","","parseArgs","",""
"","0","realigns when both branches diverge but production must track main exactly","Unit | Scripts | GitHub | Promote To Production","2026-07-07","passed","2026-07-07","","derivePromotionPlan","",""
"","1","surfaces GitHub API failures","Unit | Scripts | GitHub | Create GitHub App Installation Token","2026-07-07","passed","2026-07-07","","fetchGitHubJson","",""
"","3","selects the newest eligible artifact and excludes the current run","Unit | Allure History Artifact Restore","2026-07-07","passed","2026-07-07","","","",""
"","0","isImage(https://example.com/script.js) === false","Unit | Services | Scraper Service","2026-07-07","passed","2026-07-07","","ScraperService.isImage","",""
"","3","preserves duplicate image entries while deduping provider work","Unit | Services | Page Description Service","2026-07-07","passed","2026-07-07","","","",""
"","1","propagates prompt, model, and limit configuration","Unit | Providers | Adapter Contract Matrix","2026-07-07","passed","2026-07-07","","ollama provider adapter contract","",""
"","5","writes workflow_dispatch source-run outputs through the CLI","Unit | Scripts | GitHub | Resolve Pages Source Run","2026-07-07","passed","2026-07-07","","","",""
"","3","keeps the heartbeat alive when a lease refresh fails and recovers it on the next tick","Unit | Services | Page Description Job Concurrency","2026-07-07","passed","2026-07-07","","","",""
"","8","keeps provider validation fixtures public without authentication","Integration | API","2026-07-07","passed","2026-07-07","","API access control","",""
"","12","rejects unsupported protocols and embedded credentials","Unit | Infrastructure | Outbound URL Policy","2026-07-07","passed","2026-07-07","","","",""
"","18","keeps API and status buckets separate while sharing each scope across instances","Integration | Redis Rate Limiting","2026-07-07","passed","2026-07-07","","","",""
"","1","verifies registry signatures as an advisory, never-blocking step","Unit | Scripts | GitHub | Security Audit Workflow","2026-07-07","passed","2026-07-07","","","",""
"","1","transitions to ready and then draining","Unit | Server | Runtime State","2026-07-07","passed","2026-07-07","","","",""
"","80","is exactly what the canonical generator produces (the freshness invariant)","Unit | Scripts | OpenAPI | Freshness Check","2026-07-07","passed","2026-07-07","","committed artifact","",""
"","1","keeps CodeQL required while allowing docs-only changes to use the lightweight docs gate","Unit | Jest Lane Configs","2026-07-07","passed","2026-07-07","","","",""
"","2","writes a clean summary when no dependency changes are returned","Unit | Scripts | GitHub | Review Dependencies","2026-07-07","passed","2026-07-07","","reviewDependencies","",""
"","41","accepts non-empty API auth tokens when provided","Unit | Utils | Validate Env Vars","2026-07-07","passed","2026-07-07","","","",""
"","1","returns false for a plain string","Unit | URL Validator","2026-07-07","passed","2026-07-07","","","",""
"","1","defaults to auto mode with in-memory storage when no Redis URL is configured","Unit | Config | Rate Limit Store","2026-07-07","passed","2026-07-07","","","",""
"","22","prefers existing request ids before generating a new one","Unit | Infrastructure | Logger","2026-07-07","passed","2026-07-07","","","",""
"","1","includes derived provider validation vars and requested folders","Unit | Scripts | Run Postman Live","2026-07-07","passed","2026-07-07","","buildLiveProviderNewmanArgs","",""
"","31","Protected scraper accepts Bearer token","alt-text-generator API Contract Harness","2026-07-07","passed","2026-07-07","","08 API Auth Contract","",""
"","1","returns empty array when no models registered","Unit | Services | Image Describer Factory","2026-07-07","passed","2026-07-07","","","",""
"","0","ignores unrelated GitHub API failures","Unit | Scripts | GitHub | Promote To Production","2026-07-07","passed","2026-07-07","","isProtectedBranchRefUpdateError","",""
"","24","maps request outcomes to the expected log levels and messages","Unit | Infrastructure | Logger","2026-07-07","passed","2026-07-07","","","",""
"","1","skips restoration when the GitHub token or repository context is missing","Unit | Allure History Artifact Restore","2026-07-07","passed","2026-07-07","","","",""
"","31","creates outbound clients that use the configured CA bundle","Unit | Infrastructure | Outbound Trust","2026-07-07","passed","2026-07-07","","","",""
"","1","forwards an internal error when the describer fails","Unit | Controllers | Description Controller","2026-07-07","passed","2026-07-07","","DescriptionController.describe","",""
"","8","prints grouped diagnostics and rejects with the report path when the Newman command fails","Unit | Scripts | Postman | Newman Runner","2026-07-07","passed","2026-07-07","","","",""
"","1","treats either a header or an exact assertion as a specific status expectation","Unit | Scripts | Postman | Collection Utils","2026-07-07","passed","2026-07-07","","","",""
"","1","classifies isolated image-source failures as skippable","Unit | Providers | Adapter Contract Matrix","2026-07-07","passed","2026-07-07","","replicate provider adapter contract","",""
"","1","returns false for an empty string","Unit | URL Validator","2026-07-07","passed","2026-07-07","","","",""
"","1","keeps the promotion trust boundary: App token only, prod-validation environment","Unit | Scripts | GitHub | Rollback Production Workflow","2026-07-07","passed","2026-07-07","","","",""
"","3","composes every tier without reporters in the compatibility lane","Unit | Jest Lane Configs","2026-07-07","passed","2026-07-07","","","",""
"","0","dispatches the publish workflow for the source CI run","Unit | Scripts | GitHub | Dispatch Pages Publish","2026-07-07","passed","2026-07-07","","","",""
"","13","derives required checks from live main branch protection, never a hardcoded list","Unit | Scripts | GitHub | Promote To Production Workflow","2026-07-07","passed","2026-07-07","","","",""
"","3","derives stable JSON and JUnit report paths from the run label","Unit | Postman Harness Reporting","2026-07-07","passed","2026-07-07","","","",""
"","1","returns true for a valid https URL","Unit | URL Validator","2026-07-07","passed","2026-07-07","","","",""
"","2","adds the Allure reporter when a results directory is configured","Unit | Scripts | Run Postman Deploy","2026-07-07","passed","2026-07-07","","buildDeployNewmanArgs","",""
"","23","limits concurrent provider calls while preserving output order","Unit | Services | Page Description Service","2026-07-07","passed","2026-07-07","","","",""
"","26","Provider outage returns 500","alt-text-generator API Contract Harness","2026-07-07","passed","2026-07-07","","20 Single Description (Azure Stub)","",""
"","6","restores the environment even when the callback throws","Unit | Test Setup | testEnv helpers","2026-07-07","passed","2026-07-07","","withEnv","",""
"","1","counts folders and requests","Unit | Scripts | Postman | Collection Lint","2026-07-07","passed","2026-07-07","","summarize","",""
"","10","returns 500 on scraper failure","Integration | API","2026-07-07","passed","2026-07-07","","GET /api/scraper/images","",""
"","4","requires consecutive stable probes before continuing","Unit | Scripts | Run Postman Deploy","2026-07-07","passed","2026-07-07","","waitForStableDeploy","",""
"","8","rejects invalid CLI arguments","Unit | Scripts | GitHub | Resolve Pages Source Run","2026-07-07","passed","2026-07-07","","","",""
"","2","validates redirect targets before following them","Unit | Services | Scraper Service","2026-07-07","passed","2026-07-07","","ScraperService.getImages","",""
"","2","returns the bytes for a valid, bounded ZIP payload","Unit | Allure History Artifact Restore","2026-07-07","passed","2026-07-07","","assertArchivePayload","",""
"","1","builds API URLs relative to the configured GitHub API base","Unit | Scripts | GitHub | Resolve Pages Source Run","2026-07-07","passed","2026-07-07","","","",""
"","4","allocates the requested number of distinct free ports","Unit | Scripts | Postman | Port Allocator","2026-07-07","passed","2026-07-07","","","",""
"","1","awaits and restores after an async callback","Unit | Test Setup | testEnv helpers","2026-07-07","passed","2026-07-07","","withEnv","",""
"","1","extracts trimmed direct string payloads","Unit | Providers | Shared | Extract Caption Text","2026-07-07","passed","2026-07-07","","","",""
"","3","defines the mocked provider scopes used by the full local suite","Unit | Scripts | Postman | Local Provider Mocks","2026-07-07","passed","2026-07-07","","","",""
"","1","propagates errors from the HTTP client","Unit | Services | Azure Describer Service","2026-07-07","passed","2026-07-07","","","",""
"","3","expires in-memory jobs on read and clears state on close","Unit | Infrastructure | Description Job Store","2026-07-07","passed","2026-07-07","","","",""
"","2","runs monthly or manually with actions read access only","Unit | Scripts | GitHub | Advisory Observability Workflows","2026-07-07","passed","2026-07-07","","actions storage report workflow","",""
"","1","parses the supported base-url flag","Unit | Scripts | Run Postman Live","2026-07-07","passed","2026-07-07","","parseArgs","",""
"","5","creates a fallback root index when publishing a PR report into an empty site","Unit | Scripts | GitHub | Compose Pages Site","2026-07-07","passed","2026-07-07","","","",""
"","1","runs protected deploy verification when auth is enabled with a token","Unit | Scripts | Run Postman Deploy","2026-07-07","passed","2026-07-07","","resolveProductionDeployAuthConfig","",""
"","8","rejects missing required CLI arguments","Unit | Allure History Artifact Packaging","2026-07-07","passed","2026-07-07","","","",""
"","18","builds an aggregate summary from Newman JSON reports","Unit | Scripts | GitHub | Write Newman Summary","2026-07-07","passed","2026-07-07","","","",""
"","4","uses base64-encoded PEM values when they are provided","Unit | Infrastructure | Load TLS Credentials","2026-07-07","passed","2026-07-07","","","",""
"","2","treats docs and health endpoints as public","Unit | Middleware | Access Control","2026-07-07","passed","2026-07-07","","","",""
"","1","returns null when no caption-like text is present","Unit | Providers | Shared | Extract Caption Text","2026-07-07","passed","2026-07-07","","","",""
"","1","deletes keys given null or undefined","Unit | Test Setup | testEnv helpers","2026-07-07","passed","2026-07-07","","setEnv","",""
"","1","uses a local redis-server binary when no URL is configured","Unit | Redis Test Server Helper","2026-07-07","passed","2026-07-07","","","",""
"","0","normalizes successful image descriptions","Unit | Providers | Adapter Contract Matrix","2026-07-07","passed","2026-07-07","","openrouter provider adapter contract","",""
"","4","parses supported CLI arguments including required checks","Unit | Scripts | GitHub | Promote To Production","2026-07-07","passed","2026-07-07","","parseArgs","",""
"","1","cancels superseded runs per ref","Unit | Scripts | GitHub | Dependency Review Workflow","2026-07-07","passed","2026-07-07","","","",""
"","2","returns undefined values when no CA bundle is configured","Unit | Infrastructure | Outbound Trust","2026-07-07","passed","2026-07-07","","","",""
