"DESCRIPTION","DURATION IN MS","NAME","PARENT SUITE","START TIME","STATUS","STOP TIME","SUB SUITE","SUITE","TEST CLASS","TEST METHOD"
"","11","starts single-process runtime when worker count is one","Unit | Server | Runtime Bootstrap","2026-03-11","passed","2026-03-11","","","",""
"","5","returns 400 when image_source is missing","Integration | API","2026-03-11","passed","2026-03-11","","GET /api/accessibility/description","",""
"","2","resolves and trims the Allure results directory from the environment","Unit | Postman Harness Reporting","2026-03-11","passed","2026-03-11","","","",""
"","4","writes environment.properties and executor.json into the results directory","Unit | Allure Metadata Writer","2026-03-11","passed","2026-03-11","","","",""
"","19","Scraper missing url","alt-text-generator API Contract Harness","2026-03-11","passed","2026-03-11","","40 Negative Paths","",""
"","7","fetches and validates a history file","Unit | Allure History Fetcher","2026-03-11","passed","2026-03-11","","","",""
"","2","returns the description array on success","Unit | Controllers | Description Controller","2026-03-11","passed","2026-03-11","","DescriptionController.describe","",""
"","2","exits immediately when no shutdown handler is available","Unit | Server | Register Fatal Handlers","2026-03-11","passed","2026-03-11","","","",""
"","31","throws a helpful error when requested folders are missing","Unit | Scripts | Postman | Collection Utils","2026-03-11","passed","2026-03-11","","","",""
"","1","rejects protected requests with an invalid configured header token","Unit | Middleware | Access Control","2026-03-11","passed","2026-03-11","","","",""
"","7","extracts absolute image src attributes","Unit | Services | Scraper Service","2026-03-11","passed","2026-03-11","","ScraperService.extractImageSources","",""
"","4","configures created HTTP servers with conservative timeout defaults","Unit | Server | Server Functions","2026-03-11","passed","2026-03-11","","","",""
"","5","falls back to runtime generation when the generated spec artifact is missing","Unit | Config | Swagger","2026-03-11","passed","2026-03-11","","","",""
"","1","returns a registered describer by name","Unit | Services | Image Describer Factory","2026-03-11","passed","2026-03-11","","","",""
"","28","Unversioned single description alias","alt-text-generator API Contract Harness","2026-03-11","passed","2026-03-11","","07 Route Aliases","",""
"","1","recognizes protected-branch ref update rejections","Unit | Scripts | GitHub | Promote To Production","2026-03-11","passed","2026-03-11","","isProtectedBranchRefUpdateError","",""
"","9","uses the configured scope when the manual input is auto","Unit | Scripts | Postman | Live Provider Scope","2026-03-11","passed","2026-03-11","","resolveProviderScope","",""
"","20","Page descriptions unknown model","alt-text-generator API Contract Harness","2026-03-11","passed","2026-03-11","","40 Negative Paths","",""
"","9","throws a descriptive error for an unknown model","Unit | Services | Image Describer Factory","2026-03-11","passed","2026-03-11","","","",""
"","1","passes secure requests through so endpoint validation can handle query semantics","Unit | Middleware | Request Filter","2026-03-11","passed","2026-03-11","","","",""
"","12","rejects unsupported scope values","Unit | Scripts | Postman | Live Provider Scope","2026-03-11","passed","2026-03-11","","normalizeProviderScope","",""
"","2","skips restoration when the GitHub token or repository context is missing","Unit | Allure History Artifact Restore","2026-03-11","passed","2026-03-11","","","",""
"","8","throws when auth is enabled without any configured tokens","Unit | Middleware | Access Control","2026-03-11","passed","2026-03-11","","","",""
"","0","uses replicate when auto is the only configured provider","Unit | Scripts | Postman | Live Provider Scope","2026-03-11","passed","2026-03-11","","resolveProviderScope","",""
"","24","Versioned ping alias","alt-text-generator API Contract Harness","2026-03-11","passed","2026-03-11","","07 Route Aliases","",""
"","32","Protected scraper accepts Bearer token","alt-text-generator API Contract Harness","2026-03-11","passed","2026-03-11","","08 API Auth Contract","",""
"","3","times out with the last rollout issues when the deploy never stabilizes","Unit | Scripts | Run Postman Deploy","2026-03-11","passed","2026-03-11","","waitForStableDeploy","",""
"","3","forwards a validation error when url is missing","Unit | Controllers | Scraper Controller","2026-03-11","passed","2026-03-11","","","",""
"","5","maps nested request ids and names back to their top-level folder","Unit | Scripts | Postman | Collection Utils","2026-03-11","passed","2026-03-11","","","",""
"","1","builds a manifest with stream-specific metadata","Unit | Allure History Artifact Packaging","2026-03-11","passed","2026-03-11","","","",""
"","0","returns undefined when no upstream details are available","Unit | Utils | Get Upstream Error Summary","2026-03-11","passed","2026-03-11","","","",""
"","27","publishes runnable encoded examples for image and page endpoints","Unit | Config | Swagger","2026-03-11","passed","2026-03-11","","","",""
"","1","returns no-op when both branches already share the same tip SHA","Unit | Scripts | GitHub | Promote To Production","2026-03-11","passed","2026-03-11","","derivePromotionPlan","",""
"","1","returns no GitHub Pages URL for non-public GitHub hosts","Unit | Allure History Policy","2026-03-11","passed","2026-03-11","","","",""
"","2","derives worker count and cluster mode from config","Unit | Server | Runtime Bootstrap","2026-03-11","passed","2026-03-11","","","",""
"","1","filters unsupported sources before they reach Azure","Unit | Services | Azure Describer Service","2026-03-11","passed","2026-03-11","","","",""
"","1","allows requests through when auth is not configured","Unit | Middleware | Access Control","2026-03-11","passed","2026-03-11","","","",""
"","1","resolves per-PR history for same-repository pull requests","Unit | Allure History Policy","2026-03-11","passed","2026-03-11","","","",""
"","1","isImage(https://example.com/noextension) === false","Unit | Services | Scraper Service","2026-03-11","passed","2026-03-11","","ScraperService.isImage","",""
"","497","generates self-signed localhost credentials outside production","Unit | Infrastructure | Load TLS Credentials","2026-03-11","passed","2026-03-11","","","",""
"","1","ignores unrelated GitHub API failures","Unit | Scripts | GitHub | Promote To Production","2026-03-11","passed","2026-03-11","","isProtectedBranchRefUpdateError","",""
"","4","allows public health endpoints without authentication","Integration | API","2026-03-11","passed","2026-03-11","","API access control","",""
"","2","enforces specific status expectations across the committed Postman collection","Unit | Scripts | Postman | Collection Utils","2026-03-11","passed","2026-03-11","","","",""
"","4","rejects protected endpoints when the token is not in API_AUTH_TOKENS","Integration | API","2026-03-11","passed","2026-03-11","","API access control","",""
"","1","adds the Allure reporter when a results directory is configured","Unit | Postman Harness Reporting","2026-03-11","passed","2026-03-11","","","",""
"","1","rejects unsupported values","Unit | Scripts | Run Postman Deploy","2026-03-11","passed","2026-03-11","","normalizeBooleanFlag","",""
"","14","throws a descriptive error when Azure returns no captions","Unit | Services | Azure Describer Service","2026-03-11","passed","2026-03-11","","","",""
"","0","isImage(https://example.com/photo.webp) === true","Unit | Services | Scraper Service","2026-03-11","passed","2026-03-11","","ScraperService.isImage","",""
"","10","propagates errors from the HTTP client","Unit | Services | Azure Describer Service","2026-03-11","passed","2026-03-11","","","",""
"","58","Describe all images on fixture page","alt-text-generator API Contract Harness","2026-03-11","passed","2026-03-11","","30 Page Descriptions (Azure Stub)","",""
"","1","realigns when both branches diverge but production must track main exactly","Unit | Scripts | GitHub | Promote To Production","2026-03-11","passed","2026-03-11","","derivePromotionPlan","",""
"","3","normalizes the report URL and builds history file URLs","Unit | Allure History Fetcher","2026-03-11","passed","2026-03-11","","","",""
"","4","starts both servers and registers graceful shutdown","Unit | Server | Start Application Runtime","2026-03-11","passed","2026-03-11","","","",""
"","2","detects exact status-code headers on request items","Unit | Scripts | Postman | Collection Utils","2026-03-11","passed","2026-03-11","","","",""
"","130","shares API rate-limit counters across distinct app instances","Integration | Redis Rate Limiting","2026-03-11","passed","2026-03-11","","","",""
"","41","Unversioned scraper alias","alt-text-generator API Contract Harness","2026-03-11","passed","2026-03-11","","07 Route Aliases","",""
"","1","builds the GitHub Pages report URL for public GitHub repositories","Unit | Allure History Policy","2026-03-11","passed","2026-03-11","","","",""
"","25","forwards a validation error when image_source is missing","Unit | Controllers | Description Controller","2026-03-11","passed","2026-03-11","","DescriptionController.describe","",""
"","8","uses the documented defaults when optional env vars are unset","Unit | Config | Index","2026-03-11","passed","2026-03-11","","","",""
"","1","normalizes the bare /api/ route with a relative redirect","Unit | Middleware | Request Filter","2026-03-11","passed","2026-03-11","","","",""
"","2","strips trailing slashes from the base URL","Unit | Scripts | Run Postman Deploy","2026-03-11","passed","2026-03-11","","normalizeBaseUrl","",""
"","1","prefers explicitly provided required checks","Unit | Scripts | GitHub | Promote To Production","2026-03-11","passed","2026-03-11","","resolveRequiredChecks","",""
"","0","returns false for an empty string","Unit | URL Validator","2026-03-11","passed","2026-03-11","","","",""
"","3","detects exact status assertions in request test scripts","Unit | Scripts | Postman | Collection Utils","2026-03-11","passed","2026-03-11","","","",""
"","1","recognizes same-repository pull requests","Unit | Allure History Policy","2026-03-11","passed","2026-03-11","","","",""
"","2","returns joined captions as description","Unit | Services | Azure Describer Service","2026-03-11","passed","2026-03-11","","","",""
"","2","uses a force realignment when only branch-only history differs","Unit | Scripts | GitHub | Promote To Production","2026-03-11","passed","2026-03-11","","derivePromotionPlan","",""
"","2","starts not ready by default","Unit | Server | Runtime State","2026-03-11","passed","2026-03-11","","","",""
"","1","starts clustered mode only from the primary process","Unit | Server | Runtime Bootstrap","2026-03-11","passed","2026-03-11","","","",""
"","1","isImage(https://example.com/photo.png) === true","Unit | Services | Scraper Service","2026-03-11","passed","2026-03-11","","ScraperService.isImage","",""
"","4","responds with health info","Integration | API","2026-03-11","passed","2026-03-11","","GET /api/health","",""
"","5","returns partial page descriptions when image-specific Azure failures are skippable","Integration | API","2026-03-11","passed","2026-03-11","","GET /api/accessibility/descriptions","",""
"","33","HTTP redirects to HTTPS","alt-text-generator API Contract Harness","2026-03-11","passed","2026-03-11","","05 Routing & Redirects","",""
"","35","rejects unsupported flags","Unit | Scripts | Run Postman Deploy","2026-03-11","passed","2026-03-11","","parseArgs","",""
"","3","lists the top-level folder names from a collection","Unit | Scripts | Postman | Collection Utils","2026-03-11","passed","2026-03-11","","","",""
"","0","maps azure to azure only","Unit | Scripts | Postman | Live Provider Scope","2026-03-11","passed","2026-03-11","","getSelectedProviders","",""
"","46","throws a helpful error when a configured certificate path is invalid","Unit | Infrastructure | Load TLS Credentials","2026-03-11","passed","2026-03-11","","","",""
"","1","lists request items across nested folders","Unit | Scripts | Postman | Collection Utils","2026-03-11","passed","2026-03-11","","","",""
"","15","isImage(https://example.com/photo.jpg) === true","Unit | Services | Scraper Service","2026-03-11","passed","2026-03-11","","ScraperService.isImage","",""
"","5","returns 400 when url is missing","Integration | API","2026-03-11","passed","2026-03-11","","GET /api/scraper/images","",""
"","0","resolves relative bundle paths from the current working directory","Unit | Infrastructure | Outbound Trust","2026-03-11","passed","2026-03-11","","","",""
"","1","redirects forwarded HTTP requests using the validated forwarded host","Unit | Middleware | Request Filter","2026-03-11","passed","2026-03-11","","","",""
"","4","returns 503 while the instance is draining","Integration | API","2026-03-11","passed","2026-03-11","","GET /api/health","",""
"","1","does not restart workers that exit intentionally","Unit | Server | Cluster Manager","2026-03-11","passed","2026-03-11","","","",""
"","27","rejects unsupported workflow kinds","Unit | Allure History Policy","2026-03-11","passed","2026-03-11","","","",""
"","2","lists available models","Unit | Services | Image Describer Factory","2026-03-11","passed","2026-03-11","","","",""
"","4","keeps the root service index public without authentication","Integration | API","2026-03-11","passed","2026-03-11","","API access control","",""
"","1","isImage(https://example.com/photo.jpeg) === true","Unit | Services | Scraper Service","2026-03-11","passed","2026-03-11","","ScraperService.isImage","",""
"","20","Single description unknown model","alt-text-generator API Contract Harness","2026-03-11","passed","2026-03-11","","40 Negative Paths","",""
"","1","keeps manual deploy verification runs ephemeral unless explicitly persisted","Unit | Allure History Policy","2026-03-11","passed","2026-03-11","","","",""
"","2","collects paginated artifact results from the GitHub API","Unit | Allure History Artifact Restore","2026-03-11","passed","2026-03-11","","","",""
"","1","isImage() === false","Unit | Services | Scraper Service","2026-03-11","passed","2026-03-11","","ScraperService.isImage","",""
"","45","accepts Azure provider credentials when endpoint and subscription key are set","Unit | Utils | Validate Env Vars","2026-03-11","passed","2026-03-11","","","",""
"","2","routes fatal exceptions through the active shutdown handler","Unit | Server | Register Fatal Handlers","2026-03-11","passed","2026-03-11","","","",""
"","5","accepts X-API-Key authentication on protected endpoints","Integration | API","2026-03-11","passed","2026-03-11","","API access control","",""
"","28","uses only the development Swagger server outside production","Unit | Config | Swagger","2026-03-11","passed","2026-03-11","","","",""
"","2","returns description and imageUrl on success","Unit | Services | Replicate Describer Service","2026-03-11","passed","2026-03-11","","","",""
"","15","warns and continues when a history file is invalid","Unit | Allure History Fetcher","2026-03-11","passed","2026-03-11","","","",""
"","1","allows public requests through when auth is configured","Unit | Middleware | Access Control","2026-03-11","passed","2026-03-11","","","",""
"","16","copies the latest valid history artifact into the results directory","Unit | Allure History Artifact Restore","2026-03-11","passed","2026-03-11","","","",""
"","1","requires both azure endpoint and credential","Unit | Scripts | Postman | Live Provider Scope","2026-03-11","passed","2026-03-11","","detectAvailableProviders","",""
"","56","redirects direct HTTP traffic to HTTPS","Integration | API","2026-03-11","passed","2026-03-11","","request filter","",""
"","1","accepts true and false","Unit | Scripts | Run Postman Deploy","2026-03-11","passed","2026-03-11","","normalizeBooleanFlag","",""
"","23","rejects unsupported flags","Unit | Scripts | GitHub | Promote To Production","2026-03-11","passed","2026-03-11","","parseArgs","",""
"","5","allows protected endpoints through when auth is explicitly disabled","Integration | API","2026-03-11","passed","2026-03-11","","API access control","",""
"","8","redirects proxy-forwarded HTTP traffic to HTTPS","Integration | API","2026-03-11","passed","2026-03-11","","request filter","",""
"","5","preserves duplicate image entries while deduping provider work","Unit | Services | Page Description Service","2026-03-11","passed","2026-03-11","","","",""
"","52","rejects multi-worker startup without a shared Redis-backed store","Unit | Utils | Validate Env Vars","2026-03-11","passed","2026-03-11","","","",""
"","4","parses JSON bodies when the response is JSON","Unit | Scripts | Run Postman Deploy","2026-03-11","passed","2026-03-11","","requestDeployProbe","",""
"","3","parses the required CLI arguments","Unit | Allure History Artifact Packaging","2026-03-11","passed","2026-03-11","","","",""
"","1","resolves the effective kind from the configured mode and Redis URL","Unit | Config | Rate Limit Store","2026-03-11","passed","2026-03-11","","","",""
"","2","does not register azure when its config is incomplete","Unit | Application Composition","2026-03-11","passed","2026-03-11","","","",""
"","43","rejects an Azure endpoint without credentials","Unit | Utils | Validate Env Vars","2026-03-11","passed","2026-03-11","","","",""
"","1","isImage(https://example.com/script.js) === false","Unit | Services | Scraper Service","2026-03-11","passed","2026-03-11","","ScraperService.isImage","",""
"","2","filters model-incompatible image sources before describing a page","Unit | Services | Page Description Service","2026-03-11","passed","2026-03-11","","","",""
"","6","returns image list on success","Integration | API","2026-03-11","passed","2026-03-11","","GET /api/scraper/images","",""
"","25","Missing image returns 500","alt-text-generator API Contract Harness","2026-03-11","passed","2026-03-11","","20 Single Description (Azure Stub)","",""
"","1","persists deploy-production history on production pushes","Unit | Allure History Policy","2026-03-11","passed","2026-03-11","","","",""
"","1","converts the 404 fallback into a not-found ApiError","Unit | Middleware | Error Handler","2026-03-11","passed","2026-03-11","","","",""
"","1","writes key/value pairs to the provided file","Unit | Scripts | GitHub | Resolve Live Provider Scope","2026-03-11","passed","2026-03-11","","appendGitHubEnv","",""
"","2","shuts down the primary on SIGTERM without scheduling restarts","Unit | Server | Cluster Manager","2026-03-11","passed","2026-03-11","","","",""
"","5","reads the GitHub event payload from disk","Unit | Allure History Policy","2026-03-11","passed","2026-03-11","","","",""
"","1","forwards an internal error when the scraper service fails","Unit | Controllers | Scraper Controller","2026-03-11","passed","2026-03-11","","","",""
"","1","rejects azure scope without azure credentials","Unit | Scripts | Postman | Live Provider Scope","2026-03-11","passed","2026-03-11","","resolveProviderScope","",""
"","4","isImage(https://example.com/photo.jpg?v=123) === true","Unit | Services | Scraper Service","2026-03-11","passed","2026-03-11","","ScraperService.isImage","",""
"","29","Health","alt-text-generator API Contract Harness","2026-03-11","passed","2026-03-11","","00 Core Smoke","",""
"","53","rejects API auth enablement without any configured tokens","Unit | Utils | Validate Env Vars","2026-03-11","passed","2026-03-11","","","",""
"","3","forks the requested number of workers and restarts unexpected exits with backoff","Unit | Server | Cluster Manager","2026-03-11","passed","2026-03-11","","","",""
"","77","rejects startup when no provider is configured","Unit | Utils | Validate Env Vars","2026-03-11","passed","2026-03-11","","","",""
"","34","Swagger Spec","alt-text-generator API Contract Harness","2026-03-11","passed","2026-03-11","","00 Core Smoke","",""
"","2","defaults unit-local Redis to localhost when the topology flag is enabled","Unit | Config | Index","2026-03-11","passed","2026-03-11","","","",""
"","7","fails open when the Redis-backed limiter store errors during a request","Integration | API","2026-03-11","passed","2026-03-11","","rate limiting","",""
"","1","allows Redis to be disabled explicitly even when REDIS_URL is present","Unit | Config | Rate Limit Store","2026-03-11","passed","2026-03-11","","","",""
"","4","forwards an internal error when page orchestration fails","Unit | Controllers | Description Controller","2026-03-11","passed","2026-03-11","","DescriptionController.describePage","",""
"","25","Provider outage fails the whole page request","alt-text-generator API Contract Harness","2026-03-11","passed","2026-03-11","","30 Page Descriptions (Azure Stub)","",""
"","2","skips image-specific provider failures during page descriptions","Unit | Services | Page Description Service","2026-03-11","passed","2026-03-11","","","",""
"","1","forwards a validation error for an unknown model","Unit | Controllers | Description Controller","2026-03-11","passed","2026-03-11","","DescriptionController.describePage","",""
"","47","uses inline PEM values when they are provided","Unit | Infrastructure | Load TLS Credentials","2026-03-11","passed","2026-03-11","","","",""
"","8","continues to rate limit normal API traffic","Integration | API","2026-03-11","passed","2026-03-11","","rate limiting","",""
"","1","rejects all scope when only one provider is configured","Unit | Scripts | Postman | Live Provider Scope","2026-03-11","passed","2026-03-11","","resolveProviderScope","",""
"","1","returns ordered descriptions on success","Unit | Controllers | Description Controller","2026-03-11","passed","2026-03-11","","DescriptionController.describePage","",""
"","1","includes optional PR, Newman mode, and base URL fields when present","Unit | Allure History Artifact Packaging","2026-03-11","passed","2026-03-11","","","",""
"","1","allows protected requests with a matching token","Unit | Middleware | Access Control","2026-03-11","passed","2026-03-11","","","",""
"","10","responds with pong and mounts the request logger middleware","Integration | API","2026-03-11","passed","2026-03-11","","GET /api/ping","",""
"","1","runs protected deploy verification without a token when auth is disabled","Unit | Scripts | Run Postman Deploy","2026-03-11","passed","2026-03-11","","resolveProductionDeployAuthConfig","",""
"","3","keeps the existing CLI, JSON, and JUnit reporters by default","Unit | Postman Harness Reporting","2026-03-11","passed","2026-03-11","","","",""
"","1","rejects protected requests without a valid token","Unit | Middleware | Access Control","2026-03-11","passed","2026-03-11","","","",""
"","1","parses CLI arguments with defaults","Unit | Allure History Fetcher","2026-03-11","passed","2026-03-11","","","",""
"","1","maps all to both providers","Unit | Scripts | Postman | Live Provider Scope","2026-03-11","passed","2026-03-11","","getSelectedProviders","",""
"","28","Skips missing images and preserves successful duplicates","alt-text-generator API Contract Harness","2026-03-11","passed","2026-03-11","","30 Page Descriptions (Azure Stub)","",""
"","35","Protected description accepts X-API-Key","alt-text-generator API Contract Harness","2026-03-11","passed","2026-03-11","","08 API Auth Contract","",""
"","2","skips invalid image URLs that cannot be resolved","Unit | Services | Scraper Service","2026-03-11","passed","2026-03-11","","ScraperService.extractImageSources","",""
"","4","normalizes non-error unhandled rejections into structured fatal logs","Unit | Server | Register Fatal Handlers","2026-03-11","passed","2026-03-11","","","",""
"","1","isImage(https://example.com/photo.svg) === true","Unit | Services | Scraper Service","2026-03-11","passed","2026-03-11","","ScraperService.isImage","",""
"","5","stays available while the instance is draining","Integration | API","2026-03-11","passed","2026-03-11","","GET /api/ping","",""
"","3","maps request outcomes to the expected log levels and messages","Unit | Infrastructure | Logger","2026-03-11","passed","2026-03-11","","","",""
"","2","does not register clip when the Replicate token is missing","Unit | Application Composition","2026-03-11","passed","2026-03-11","","","",""
"","28","rejects unsupported CLI arguments","Unit | Scripts | GitHub | Write Newman Summary","2026-03-11","passed","2026-03-11","","","",""
"","19","keeps API and status buckets separate while sharing each scope across instances","Integration | Redis Rate Limiting","2026-03-11","passed","2026-03-11","","","",""
"","29","fails fast when Redis mode is selected without a Redis URL","Unit | Infrastructure | Rate Limit Store","2026-03-11","passed","2026-03-11","","","",""
"","1","writes the pid file only from the primary process","Unit | Server | Runtime Bootstrap","2026-03-11","passed","2026-03-11","","","",""
"","3","treats docs and health endpoints as public","Unit | Middleware | Access Control","2026-03-11","passed","2026-03-11","","","",""
"","1","falls back to azure when auto is requested and both providers are configured","Unit | Scripts | GitHub | Resolve Live Provider Scope","2026-03-11","passed","2026-03-11","","resolveScopeFromEnv","",""
"","13","uses process-stream logging in production without touching the filesystem","Unit | Infrastructure | Logger","2026-03-11","passed","2026-03-11","","","",""
"","1","normalizes unexpected errors into a generic internal response","Unit | Middleware | Error Handler","2026-03-11","passed","2026-03-11","","","",""
"","3","builds environment properties from the current runtime and CI env","Unit | Allure Metadata Writer","2026-03-11","passed","2026-03-11","","","",""
"","1","returns scraped images on success","Unit | Controllers | Scraper Controller","2026-03-11","passed","2026-03-11","","","",""
