"DESCRIPTION","DURATION IN MS","NAME","PARENT SUITE","START TIME","STATUS","STOP TIME","SUB SUITE","SUITE","TEST CLASS","TEST METHOD"
"","3","wraps store operations so request-time store errors fail open","Unit | Infrastructure | Rate Limit Store","2026-03-11","passed","2026-03-11","","","",""
"","1","isImage(https://example.com/page.html) === false","Unit | Services | Scraper Service","2026-03-11","passed","2026-03-11","","ScraperService.isImage","",""
"","4","rejects artifacts with mismatched manifests without failing the build","Unit | Allure History Artifact Restore","2026-03-11","passed","2026-03-11","","","",""
"","0","normalizes case and whitespace","Unit | Scripts | Postman | Live Provider Scope","2026-03-11","passed","2026-03-11","","normalizeProviderScope","",""
"","1","rejects malformed direct host headers instead of redirecting","Unit | Middleware | Request Filter","2026-03-11","passed","2026-03-11","","","",""
"","1","returns true for a valid https URL","Unit | URL Validator","2026-03-11","passed","2026-03-11","","","",""
"","41","rejects a negative TRUST_PROXY_HOPS override","Unit | Utils | Validate Env Vars","2026-03-11","passed","2026-03-11","","","",""
"","6","treats a cold-start stream as a non-fatal skip","Unit | Allure History Artifact Restore","2026-03-11","passed","2026-03-11","","","",""
